林,,,"Chữ tượng hình phỏng theo hình dạng sự vật có thể tạo chữ nhanh nhưng hạn chế trong việc biểu hiện nhiều nghĩa khác nhau. Vì vậy, một phương pháp được nghĩ ra là kết hợp các chữ tượng hình đã có để tạo ra nghĩa mới, gọi là chữ hội ý (會意文字). Trong đó, việc kết hợp các chữ tượng hình giống nhau gọi là đồng thể hội ý (同體會意). Vì kết hợp các chữ giống nhau nên tạo hiệu quả tăng thêm nghĩa gốc. Chữ 林 (lâm) có nghĩa là 'rừng' chính là như vậy. Chữ 林 là vẽ chồng chữ 木 (mộc - gỗ) để biểu hiện nghĩa 'nhiều cây'. Chữ chỉ nơi có nhiều cây hơn chữ Lâm là chữ 森 (sâm - rậm rạp) có nghĩa là 'rậm rạp'.",,,,,
男,,,"Chữ 男 (nam) là chữ có nghĩa là 'đàn ông' hay 'con trai'. Chữ 男 là hình ảnh kết hợp giữa chữ 田 (điền - ruộng) và chữ 力 (lực - sức mạnh). Chữ 力 vẽ cái cày ruộng, có nghĩa là 'sức mạnh' hay 'dùng sức'. Chữ Nam, kết hợp chữ 田 vào chữ 力 vẽ cái cày như vậy, là vẽ ruộng và cái cày cùng nhau. Công việc nông nghiệp cổ đại hoàn toàn phụ thuộc vào sức lao động, đều là việc của đàn ông. Chữ Nam là chữ phản ánh nhận thức đó, có nghĩa là 'đàn ông', người dùng sức làm nông.",,,,,
读,,,"Chữ 讀 (độc) là chữ có nghĩa là 'đọc' hay 'hiểu'. Chữ 讀 là hình ảnh kết hợp giữa chữ 言 (ngôn - lời nói) và chữ 賣 (mại - bán). Chữ 賣 biểu hiện hình ảnh bán hàng, có nghĩa là 'bán'. Sau khi bán hàng, người ta sẽ tính toán xem kiếm được bao nhiêu. Do đó, chữ Độc, kết hợp chữ 言 vào chữ 賣 có nghĩa 'bán' như vậy, có nghĩa là đếm (言) tiền sau khi bán hàng (賣). Nghĩa 'tính toán' hay 'đếm' vẫn còn trong chữ Độc cũng là vì lẽ này. Do đó, chữ Độc ban đầu được dùng với nghĩa lẩm bẩm khi đếm tiền, nhưng sau này nghĩa này được mở rộng thành nghĩa 'đọc'.",,,,,
北,,,"Chữ 北 (bắc) là chữ có nghĩa là 'bắc' hay 'phía bắc'. Nhìn vào chữ Bắc trong giáp cốt văn, hình ảnh hai người quay lưng vào nhau được vẽ. Do đó, nghĩa gốc của chữ 北 là 'quay lưng lại' hay 'phía sau'. Tuy nhiên, sau này khi kiểu nhà ở hướng nam trở nên phổ biến, chữ Bắc có nghĩa là 'phía bắc' với ý nghĩa hướng ngược lại với hướng nam. Tức là chữ Bắc có nghĩa là 'phía bắc' từ ý nghĩa 'phía sau lưng' vì người hoặc cửa nhà đều nhìn về phía nam. Khi chữ Bắc có nghĩa là 'phía bắc' như vậy, hiện nay chữ 背 (bối/bội - lưng/quay lưng) được thêm chữ 月 (nhục nguyệt - thịt) vào để thay thế nghĩa 'quay lưng lại'.",,,,,
京,,,"Chữ 京 (kinh) là chữ có nghĩa là 'kinh đô' hay 'thủ đô', 'lớn'. Mặc dù chữ 亠 (đầu heo?) được chỉ định làm bộ thủ của chữ 京, nhưng nó không liên quan gì đến đầu heo. Nhìn vào chữ Kinh trong giáp cốt văn, tòa nhà lớn được dựng trên cột. Đây là biểu hiện của tòa nhà lớn. Do đó, nghĩa gốc của chữ 京 là 'cao' hay 'lớn'. Chữ Kinh vẽ tòa nhà cao và lớn để biểu hiện nghĩa 'cao' hay 'lớn'. Ở kinh đô nơi mọi người tụ tập, có nhiều tòa nhà lớn. Do đó, chữ Kinh sau này có nghĩa là 'kinh đô' hay 'thủ đô'.",,,,,
很,,彳、艮,"Được tạo thành từ bộ xích (彳 ☞ đi, đi khập khiễng) biểu thị ý nghĩa và chữ Cấn (艮 → Hấn) biểu thị âm đọc (gan → heun) hợp lại.",,,,,
说,,,"Chữ 說 (thuyết) là chữ có nghĩa là 'lời nói' hay 'kể chuyện'. Trong số nhiều chữ liên quan đến 'nói', chữ 說 có nghĩa 'kể chuyện' nổi bật nhất. Nhìn vào cấu tạo của chữ 說 sẽ biết lý do. Chữ 說 là hình ảnh kết hợp giữa chữ 言 và chữ 兌 (đoài - vui vẻ). Chữ 兌 vẽ hình ảnh há miệng cười, có nghĩa là 'vui vẻ'. Chữ Thuyết, kết hợp chữ 言 vào chữ 兌 vẽ hình ảnh há miệng như vậy, biểu hiện hình ảnh nói chuyện với ai đó một cách vui vẻ. Do đó, chữ 說 chủ yếu được dùng với nghĩa là 'kể chuyện' hay 'trình bày', 'vận động tranh cử' như là há miệng nói lớn.",,,,,
听,,,"Chữ 聽 (thính) là chữ có nghĩa là 'nghe' hay 'tiếp nhận'. Chữ 聽 là hình ảnh kết hợp giữa chữ 耳 (nhĩ - tai), chữ 壬 (nhâm - can chi), chữ 悳 (đức - đức hạnh). Tuy nhiên, trong giáp cốt văn, chỉ đơn thuần là chữ 耳 và hai chữ 口 (khẩu - miệng) được vẽ. Đây là biểu hiện của việc chăm chú lắng nghe lời nói của ai đó. Sau này chữ 口 bị lược bỏ, và thay vào đó chữ 悳 vẽ mắt và tim, cùng chữ 壬 được thêm vào, có nghĩa là 'người (壬) nhìn (直) nghe (耳) và cảm nhận (心)'. Mặc dù nét chữ trở nên phức tạp hơn, nhưng để biểu hiện tất cả từ nghĩa đơn thuần là 'nghe' đến 'nghe, tha thứ và xem xét', nên đã kết hợp nhiều chữ khác nhau như vậy.",,,,,
钱,,,"Chữ 錢 (tiền) là chữ có nghĩa là 'tiền' hay 'tiền tệ', 'đồng xu'. Chữ 錢 là hình ảnh kết hợp giữa chữ 金 (kim - kim loại) và chữ 戔 (tiễn - chất đống). Chữ 戔 (tiễn - chất đống) được dùng trong chữ 錢 biểu hiện hình ảnh nhiều ngọn mâu xếp chồng lên nhau, có nghĩa là 'chất đống'. Chữ Tiền ban đầu là chữ chỉ tiền đồng được đúc (엽전). Lịch sử tiền đồng bắt đầu sau khi nhà Tần thống nhất thiên hạ. Sau khi thống nhất, Tần Thủy Hoàng cho đúc tiền Bán Lượng (半兩錢), đây là loại tiền đồng hình tròn. Tiền đồng được xâu dây qua lỗ và mang theo theo bó, nên chữ 戔 có nghĩa 'chất đống' có thể nói là vừa truyền đạt ý nghĩa vừa là âm đọc.",,,,,
信,,,"Chữ 信 (tín) là chữ có nghĩa là 'tin tưởng', 'tin nhiệm'. Chữ 信 là hình ảnh kết hợp giữa chữ 人 (nhân - người) và chữ 言 (ngôn - lời nói). Tuy nhiên, nghĩa 'tin tưởng' ban đầu dùng chữ 㐰 (tín - tin tưởng) kết hợp chữ 人 và chữ 口 (khẩu - miệng). Sau đó trong tiểu triện, chữ 口 đổi thành chữ 言, tạo thành chữ 信 biểu hiện rõ ràng hơn nghĩa gốc. Lời nói của con người phải đáng tin cậy và không được dối trá. Do đó, chữ 信 được dùng với nghĩa là 'tin tưởng' hay 'tin cậy', 'tin nhiệm'.",,,,,
见,jiàn,,"Chữ 見 (kiến/hiện) là chữ có nghĩa là 'nhìn'. Chữ 見 là hình ảnh kết hợp giữa chữ 目 (mục - mắt) và chữ 儿 (nhân - người hiền). Nhìn vào chữ Kiến trong giáp cốt văn, chữ 人 (nhân - người) được vẽ với đôi mắt to. Đây là vẽ nhấn mạnh đôi mắt nhìn sự vật, biểu hiện nghĩa 'nhìn'. Tuy nhiên, trong chữ Hán, chữ 目 chủ yếu được dùng với nghĩa liên quan đến 'mắt', còn chữ 見 chủ yếu được dùng cho hành động nhìn như 'nhìn', nên tốt nhất là ghi nhớ sự khác biệt này. Ngoài ra, trước đây chữ 見 từng được dùng thay cho chữ 現 (hiện - xuất hiện), nên nó cũng có nghĩa là 'xuất hiện' hay 'được nhìn thấy'. Lúc đó phát âm là 'hiện'. Tuy nhiên, nghĩa cơ bản của chữ 見 là 'nhìn', nên khi được dùng làm bộ thủ, nó truyền đạt ý nghĩa liên quan đến 'việc nhìn' hay 'thứ được nhìn thấy'.",,觉、观、览,,,
鸡,,,"Chữ 鷄 (kê) là chữ có nghĩa là 'gà'. Chữ 鷄 là hình ảnh kết hợp giữa chữ 奚 (hề - cớ gì/gà) và chữ 鳥 (điểu - chim). Chữ 奚 vẽ hình ảnh nắm lấy búi tóc bằng tay, nhưng ở đây được ứng dụng làm mào gà. Thực ra chữ 鷄 trong giáp cốt văn trực quan hơn. Mào gà, chân và đuôi đều được mô tả rõ ràng, nên nhìn một cái là biết đây là vẽ con gà. Tuy nhiên, khi chuyển sang tiểu triện, chữ 奚 thay thế mào gà, và chữ 隹 (chuy - chim) được thêm vào, tạo thành chữ 雞 (kê - gà) có nghĩa là chim có mào. Tuy nhiên, ngay cả chữ này trong khải thư, chữ 隹 đã đổi thành chữ 鳥, nên chữ 鷄 hiện nay được dùng với nghĩa là 'gà'.",,,,,
再,,,"Chữ 再 (tái) là chữ có nghĩa là 'lặp lại' hay 'nhiều lần', 'lại'. Mặc dù chữ 冂 (quỳnh - xa) được chỉ định làm bộ thủ của chữ 再, nhưng nó không liên quan gì đến nghĩa 'xa'. Nhìn vào chữ Tái trong giáp cốt văn, có một nét gạch được vẽ ở miệng và đuôi cá. Đây là biểu hiện của mặt nước trên và dưới. Cá thường đưa miệng lên mặt nước để thở khi thiếu oxy. Chữ 再 biểu hiện hình ảnh đó, có nghĩa là 'lại' từ ý nghĩa con cá lặp đi lặp lại hành động đó.",,,,,
星,,,"Chữ 星 (tinh) là chữ có nghĩa là 'sao' hay 'thiên văn'. Chữ 星 là hình ảnh kết hợp giữa chữ 日 (nhật - mặt trời/ngày) và chữ 生 (sinh - sinh ra/cây). Chữ 生 vẽ cây cỏ. Tuy nhiên, nhìn vào chữ Tinh trong giáp cốt văn, chữ 口 (khẩu - miệng) được vẽ hai bên chữ 生. Chữ 口 ở đây biểu hiện các ngôi sao trên bầu trời đêm. Tuy nhiên, trong kim văn, chữ 口 đổi thành chữ 日 được vẽ treo ở đầu ngọn cỏ, và trong tiểu triện, chỉ dùng một chữ 日, tạo thành chữ Tinh hiện nay.",,,,,
期,,月,"Chữ 期 (kỳ) là chữ có nghĩa là 'kỳ hạn' hay 'hứa hẹn'. Chữ 期 là hình ảnh kết hợp giữa chữ 其 (kỳ - đó) và chữ 月 (nguyệt - mặt trăng/tháng). Chữ 其 có nghĩa là 'đó' hay 'cái đó', nhưng ở đây chỉ đóng vai trò phát âm. Mặt trăng thay đổi hình dạng theo chu kỳ, nên người xưa dựa vào sự thay đổi của mặt trăng để biết thời gian trôi qua. Vì vậy, chữ 月 được dùng trong chữ Kỳ có thể nói là để chỉ sự trôi chảy của thời gian.",,,,,
弟,,,"Chữ 弟 (đệ) là chữ có nghĩa là 'em trai' hay 'người nhỏ tuổi hơn'. Mặc dù chữ 弓 (cung - cung tên) được chỉ định làm bộ thủ của chữ 弟, nhưng nó không liên quan gì đến 'cung'. Bởi vì chữ 弟 là chữ vẽ hình ảnh sợi dây quấn quanh khúc gỗ. Chữ 弟 ban đầu có nghĩa là 'thứ tự' hay 'lần lượt' vì sợi dây được buộc theo thứ tự vào khúc gỗ. Tuy nhiên, sau này khi nó có nghĩa là thứ tự giữa anh em, tức là 'em trai', nên hiện nay chữ 第 (đệ - thứ tự) được thêm chữ 竹 (trúc - tre) vào để thay thế nghĩa gốc.",,,,,
妈,,,Âm đọc gốc của 「마」 là 「mỗ」. Được tạo thành từ bộ nữ (女 ☞ phụ nữ) biểu thị ý nghĩa và chữ Mã (馬 - ngựa) biểu thị âm đọc (ma) hợp lại.,,,,,
衣,,,"Chữ 衣 (y) là chữ có nghĩa là 'áo' hay 'mặc'. Chữ 衣 vẽ 'áo trên', trong giáp cốt văn vẽ cả cổ áo, hai ống tay áo và vạt áo cùng nhau. Do đó, nghĩa gốc của chữ 衣 cũng là 'áo trên'. Cổ đại, áo trên được gọi là 衣, áo dưới gọi là 裳 (thường - váy). Lý do gọi 'áo' là y phục (衣裳) là vì kết hợp áo trên và áo dưới. Tuy nhiên, chữ 衣 hiện nay không phân biệt điều này, nên khi được dùng làm bộ thủ, nó chỉ truyền đạt ý nghĩa liên quan đến 'áo'. Điều cần chú ý là khi chữ 衣 được dùng làm bộ thủ, nó đổi thành 衤, nên có thể nhầm lẫn với bộ thủ của chữ 示=礻 (thị - biểu thị).",,,,,
服,fú,月、𠬝,"Chữ 服 (phục) là chữ có nghĩa là 'y phục' hay 'phục tùng'. Chữ 服 là hình ảnh kết hợp giữa chữ 月 (nguyệt - mặt trăng), chữ 卩 (tiết - khớp/ấn hiệu), chữ 又 (hữu - lại/tay). Tuy nhiên, chữ Phục không liên quan gì đến 'mặt trăng'. Bởi vì, trong giáp cốt văn vẽ thuyền (舟). Chữ Phục trong giáp cốt văn biểu hiện hình ảnh dẫn dắt (又) người đang quỳ gối (卩) lên thuyền (舟). Người quỳ gối ở đây là tội nhân. Tức là chữ Phục vẽ hình ảnh áp giải tội nhân lên thuyền. Do đó, chữ Phục được tạo ra với nghĩa là 'bắt phục tùng' hay 'đầu hàng' từ ý nghĩa bắt tội nhân tuân theo, nhưng sau này nghĩa 'y phục' được phái sinh. Lưu ý, trong chữ Hán có trường hợp chữ 舟 bị nhầm sang chữ 月.",【服务、衣服】,,,,
衤,,,,,,,,
礻 ,,,,,,,,
光,,儿,"Chữ 光 (quang) là chữ có nghĩa là 'ánh sáng' hay 'sáng'. Chữ 光 là hình ảnh kết hợp giữa chữ 儿 (nhân - người hiền) và chữ 火 (hỏa - lửa). Chữ Quang vẽ hình ảnh ánh sáng phát ra trên đầu người. Nhìn vào chữ Quang trong giáp cốt văn, chữ 火 (hỏa - lửa) được vẽ phía trên chữ 儿. Điều này biểu hiện xung quanh người rất sáng. Do đó, chữ Quang có nghĩa là 'ánh sáng' hay 'chiếu sáng'.",,,,,
盘,,,"Chữ 盤 (bàn) là chữ có nghĩa là 'mâm' hay 'khay'. Chữ 盤 là hình ảnh kết hợp giữa chữ 般 (ban - thông thường) và chữ 皿 (mãnh - bát đĩa). Chữ 般 vẽ hình ảnh dùng thìa lấy thức ăn trong bát, nghĩa gốc là 'mâm'. Do đó, chữ 般 được dùng trước với nghĩa là 'mâm'. Tuy nhiên, sau này nghĩa ăn cơm là việc rất 'thường ngày' được mở rộng, nên nó được giả tá (mượn nghĩa) thành nghĩa 'thông thường'. Do đó, trong kim văn, chữ 盤 được thêm chữ 皿 vào để có nghĩa là 'mâm' hay 'khay' đựng thức ăn. Lưu ý, chữ 舟 (chu - thuyền) được dùng trong chữ 盤 là do cái bát trong giáp cốt văn bị thay đổi nhầm.",,,,,
重,,,"Chữ 重 (trọng/trùng) là chữ có nghĩa là 'nặng' hay 'quý báu'. Mặc dù chữ 里 (lý - làng) được chỉ định làm bộ thủ của chữ 重, nhưng nó không liên quan gì đến làng. Bởi vì chữ 重 là sự kết hợp của chữ 東 (đông - hướng đông/gói đồ) và chữ 人 (nhân - người). Chữ 東 ban đầu vẽ gói đồ được buộc chặt bốn phía bằng dây. Nhìn vào chữ Trọng trong kim văn, chữ 東 được vẽ dưới chữ 人, điều này biểu hiện nghĩa đang vác gói đồ trên lưng. Do đó, chữ 重 có nghĩa là 'nặng' từ ý nghĩa vác gói đồ nặng. Trong gói đồ có những thứ rất quan trọng như hạt giống cây trồng. Vì vậy, chữ 重 cũng có nghĩa là 'quý báu' hay 'quan trọng'.",,,,,
药,,,"Chữ 藥 (dược) là chữ có nghĩa là 'thuốc' hay 'dược thảo'. Chữ 藥 là hình ảnh kết hợp giữa chữ 艹 (thảo - cỏ) và chữ 樂 (lạc - vui). Chữ 樂 vẽ nhạc cụ có dây như đàn tranh, có nghĩa là 'phong lưu' hay 'vui vẻ'. Bị bệnh rõ ràng là trạng thái không vui. Do đó, sự kết hợp của chữ 樂 có nghĩa 'vui vẻ' và chữ 艹 có nghĩa cỏ là nghĩa ăn dược thảo (艹) để quay trở lại trạng thái vui vẻ (樂).",,,,,
把,,,"Chữ 把 có nghĩa là 'nắm' hay 'cầm'. Chữ 把 là hình ảnh kết hợp giữa chữ 手 (thủ - tay) và chữ 巴 (ba - đuôi). Nghĩa từ điển của chữ 巴 là 'đuôi', nhưng nhìn vào chữ Ba trong giáp cốt văn, có thể thấy đó là vẽ người đang vươn tay. Hình ảnh quỳ gối và vươn tay dài ra như thể sắp nắm lấy thứ gì đó. Chữ Bả là chữ biểu hiện nghĩa vươn tay nắm lấy vật gì đó, được tạo ra bằng cách thêm chữ 手 vào chữ 巴 vẽ hình ảnh vươn tay như vậy.",,,,,
箱,,,"Được tạo thành từ bộ trúc (竹(=𥫗) ☞ tre) biểu thị ý nghĩa và chữ 相 (tương), đồng thời biểu thị âm đọc (sang) và có ý nghĩa 「bị che khuất, không nhìn thấy được bởi người khác (≒ chướng)」. Có nghĩa là 「hộp tre」.",,,,,
旧,,,"Chữ 舊 (cựu) là chữ có nghĩa là 'lâu đời' hay 'xưa'. Chữ 舊 là hình ảnh kết hợp giữa chữ 萑 (hoàn - cỏ nhiều) và chữ 臼 (cữu - cối). Chữ 臼 chỉ dùng làm chữ tượng hình và không liên quan gì đến nghĩa. Chữ Cựu ban đầu là chữ được tạo ra để chỉ nghĩa 'cú lợn'. Cú lợn đặc trưng bởi lông mày đậm. Do đó, trong giáp cốt văn, lông mày được vẽ phía trên chữ 隹 (chuy - chim) có nghĩa là chim. Bên dưới có chữ 口 (khẩu - miệng), đây là mô tả con cú lợn trong tổ. Hình ảnh này sau này được biểu hiện bằng sự kết hợp của chữ 萑 và chữ 臼. Tuy nhiên, bất kể nguồn gốc này, chữ 舊 là chữ được giả tá (mượn nghĩa) cho nghĩa là 'lâu đời' vì có cùng âm với chữ 久 (cửu - lâu). Việc nghĩa chuyển sang một chữ có nhiều nét phức tạp là không phổ biến, nên đây là một trường hợp rất bất thường.",,,,,
茶,,艹、人、木,"Chữ 茶 (trà) là chữ có nghĩa là 'trà' hay 'cây trà'. Chữ 茶 là hình ảnh kết hợp giữa chữ 艹 (thảo - cỏ) và chữ 余 (dư - tôi/nhà nhỏ). Trung Quốc là đất nước của trà. Theo truyền thuyết, vào năm 2737 TCN, Thần Nông (神農氏), hoàng đế cổ đại của Trung Quốc, đã phát hiện ra trà và phổ biến rộng rãi cho dân chúng. Ban đầu trà được uống làm thuốc, nhưng hiện nay được sử dụng rộng rãi làm đồ uống. Chữ 艹 được dùng trong chữ 茶 có nghĩa là lá trà. Chữ 余 vẽ ngôi nhà nhỏ. Vì vậy, có thể nói chữ Trà được tạo ra với nghĩa là thưởng trà trong ngôi nhà giản dị. Lưu ý, chữ 茶 trong tiếng Hàn cũng đọc là 'đa'. Mặc dù hiện nay đã ít đi, nhưng 'đá phòng' (다방) thực chất là đọc tiếng Hàn của 'trà phòng'.",,,,,
叶,,,"口 biểu thị lời nói, 十 biểu thị số nhiều ⇒ đồng thanh, đồng điệu, nhiều người cùng một lời chỉ nghĩa đồng lòng. Sau giản thể chuyển thành nghĩa lá cây.",,,,,
椅,,,Được tạo thành từ bộ mộc (木 ☞ gỗ) biểu thị ý nghĩa và chữ Kỳ (奇 → Y) biểu thị âm đọc (gi → ui) hợp lại.,,,,,
奇,,,"Chữ 奇 có nghĩa là 'kỳ lạ' hay 'đặc biệt'. Chữ 奇 là hình ảnh kết hợp giữa chữ 大 (đại - lớn) và chữ 可 (khả - đúng). Chữ 可 vẽ cái cuốc và miệng cùng nhau. Chữ Kỳ, kết hợp chữ 大 vào, được giải thích theo hai cách. Một là giải thích người (大) đứng trên cái cuốc (可) là 'kỳ lạ' hay 'quái gở'. Cách khác là giải thích dáng vẻ người (大) đang làm việc (可) là 'đặc biệt' hay 'xuất sắc'.",,,,,
支,,,"Chữ 支 có nghĩa là 'chống đỡ' hay 'chịu đựng', 'duy trì'. Chữ 支 là hình ảnh kết hợp giữa chữ 又 (hữu - lại/tay) và chữ 十 (thập - mười). Chữ 十 được dùng trong chữ 支 không liên quan đến số mà biểu hiện cành cây. Chữ 支 ban đầu là chữ được tạo ra để chỉ 'cành cây'. Tuy nhiên, sau này chữ 枝 (chi - cành) được thêm chữ 木 (mộc - gỗ) vào để phái sinh nghĩa 'cành cây', còn chữ 支 được dùng với nghĩa là 'chống đỡ' hay 'chịu đựng'.",,,,,
平,,,"Chữ 平 có nghĩa là 'bằng phẳng' hay 'đều đặn'. Chữ 平 là hình ảnh kết hợp giữa chữ 干 (can - khiên/lá chắn) và chữ 八 (bát - tám). Tuy nhiên, chữ Bình không liên quan gì đến 'lá chắn' và cũng không mô phỏng hình dạng sự vật. Bởi vì chữ 平 là hình tượng hóa ý nghĩa âm thanh nhạc cụ lan tỏa đều đặn. Chữ Bình có nghĩa là đều đặn hay bằng phẳng từ ý nghĩa âm thanh lan tỏa đều đặn, và sau này các nghĩa 'ổn định' hay 'hòa thuận' cũng được phái sinh.",,,,,
板,,,"Chữ 板 có nghĩa là 'tấm ván' hay 'tấm gỗ'. Chữ 板 là hình ảnh kết hợp giữa chữ 木 (mộc - gỗ) và chữ 反 (phản - lật lại). Chữ 反 vẽ hình ảnh dùng tay lật vật gì đó, nhưng ở đây chỉ đóng vai trò phát âm 'phản → bản'. Tuy nhiên, trong tiểu triện, chữ 版 (bản - tấm ván) có chữ 片 (phiến - miếng) được dùng với nghĩa là 'tấm ván'. Nhưng từ khải thư trở đi, chữ 板 có chữ 木 được thay thế.",,,,,
脑,,,"Chữ 腦 có nghĩa là 'óc' hay 'não', 'đầu'. Chữ 腦 là hình ảnh kết hợp giữa chữ ⺼ (nhục nguyệt - thịt) và hình dáng mô phỏng đỉnh đầu. Phần bên phải của chữ 腦 là biểu hiện khí (氣) hoặc lỗ thở lên từ đầu người. Chữ Não là chữ biểu hiện 'não' của con người bằng cách kết hợp hình ảnh đỉnh đầu người như vậy và chữ ⺼. Thực ra trong tiểu triện, chữ 匘 (não - óc) có chữ 匕 (chủy - cái thìa/người chết?) được dùng, nhưng trong khải thư nó đổi thành chữ 腦 để biểu thị đây là chữ liên quan đến cơ thể.",,,,,
地,,,"Chữ 地 có nghĩa là 'đất' hay 'đất đai', 'địa điểm'. Chữ 地 là hình ảnh kết hợp giữa chữ 土 (thổ - đất) và chữ 也 (dã - cũng/ấm). Chữ 也 vẽ cái ấm. Chữ Địa, kết hợp chữ 土 vào chữ 也 vẽ cái ấm đựng nước như vậy, biểu hiện nghĩa 'đất' có đất và nước. Chữ Địa cũng được xem là vẽ cùng 'đất đai (土) và rắn (也)' với ý nghĩa nơi có cỏ dại mọc um tùm thường thấy rắn.",,,,,
笔,,,"Chữ 筆 có nghĩa là 'bút' hay 'chữ viết', 'dụng cụ viết'. Chữ 筆 là hình ảnh kết hợp giữa chữ 竹 (trúc - tre) và chữ 聿 (duật - bút). Chữ 聿 vẽ hình ảnh cầm bút trong tay. Do đó, chữ 聿 được dùng trước với nghĩa là 'bút'. Tuy nhiên, trong tiểu triện, chữ 竹 được thêm vào để chỉ chất liệu của bút, tạo thành chữ Bút hiện nay.",,,,,
雨,,,"Trung Quốc cổ đại là xã hội nông nghiệp nên rất coi trọng nông nghiệp. Thành công hay thất bại của nông nghiệp liên quan trực tiếp đến thời tiết. Có lẽ vì vậy mà trong Hán tự xuất hiện nhiều chữ liên quan đến thời tiết. Chữ 雨 (vũ) biểu hiện hình ảnh giọt nước rơi từ trời xuống, đã ảnh hưởng nhiều đến việc tạo ra các chữ liên quan đến thời tiết từ khi chữ Hán bắt đầu hình thành. Nhìn vào chữ 雨 trong giáp cốt văn, có một nét gạch được vẽ trên trời và dưới đó là những chấm. Điều này biểu hiện hình ảnh hạt mưa rơi xuống dưới đám mây. Do đó, khi chữ 雨 được dùng làm bộ thủ, nó chủ yếu truyền đạt ý nghĩa liên quan đến thời tiết hay hiện tượng khí tượng.",,,,,
伞,,,Tán (傘) là mô phỏng hình dáng cái ô mở ra.,,,,,
词,,,"Chữ 詞 (từ) là chữ có nghĩa là 'lời nói' hay 'văn chương'. Trong các chữ liên quan đến 'nói', chữ 詞 có nghĩa 'văn chương' nổi bật nhất. Chữ 詞 ban đầu dùng chữ 司 mà không có chữ 言. Chữ 司 vẽ hình ảnh vươn tay ra lệnh, có nghĩa là 'chủ trì' hay 'đảm nhận'. Chữ 司 được dùng với nghĩa là tư lệnh (司令) hay tư pháp (司法) cũng là vì nó chỉ mệnh lệnh do người có chức vụ cao ban ra. Trong tiểu triện, chữ 詞 được thêm chữ 言 phái sinh, điều này là để chỉ 'lời nói' của người có chức vụ cao. Tuy nhiên, chữ 詞 hiện nay chỉ được dùng với nghĩa đơn thuần liên quan đến 'văn viết' như 'thơ văn' hay 'văn thể', 'văn chương'.",,,,,
典,,,"Chữ 典 (điển) là chữ có nghĩa là 'pháp luật' hay 'pháp điển', 'kinh điển'. Chữ 典 là hình ảnh kết hợp giữa chữ 冊 (sách - sách) và chữ 廾 (củng - chắp tay). Chữ 冊 vẽ 'sách' làm bằng thẻ tre được xâu lại. Chữ Điển, được thêm chữ 廾 vào chữ 冊 vẽ sách làm bằng thẻ tre như vậy, là biểu hiện của việc nâng niu sách. Nâng niu sách bằng hai tay có nghĩa là sách rất quan trọng. Do đó, chữ 典 có nghĩa là 'sách vở' hay 'pháp điển', 'pháp luật', 'nghi thức' từ ý nghĩa sách rất quan trọng.",,,,,
