积,,,"Chữ 積 là chữ có nghĩa là 'tích lũy' hay 'tiết kiệm'. Chữ 積 là hình ảnh kết hợp giữa chữ 禾 (hòa - lúa) và chữ 責 (trách - nợ). Chữ 責 là chữ có nghĩa là 'nợ', vẽ đồng tiền có gai. Chữ 積, kết hợp thêm chữ 禾, có nghĩa là các bó lúa chất chồng lên nhau như nợ nần không ngừng tăng lên. Tuy nhiên, chữ 積 hiện nay được dùng với nghĩa chung là 'tích lũy' hay 'chất chồng'.",,,,,
层,,,"尸 giản lược của 屋, 云 giản lược của chữ 曾. Chữ 层 kết hợp yếu tố 尸 (nhà) và 曾 (tấm ván ngăn, ám chỉ sự phân tầng) ⇒ Biểu thị một “ngôi nhà nhiều tầng có ngăn cách bằng ván”.",,,,,
赶,gǎn,走、干,Được tạo thành từ bộ tẩu (走 ☞ chạy) biểu thị ý nghĩa và chữ 干 (can) biểu thị âm đọc (gan).,【赶紧】,,,,
卧,,,"Chữ 臥 là chữ có nghĩa là 'nằm sấp' hay 'nằm xuống'. Chữ 臥 là hình ảnh kết hợp giữa chữ 臣 (thần - bề tôi) và chữ 人 (nhân - người). Chữ 臣 vẽ con mắt của người cúi đầu. Nhìn vào chữ 臥 trong kim văn, chữ 臣 và chữ 人 được vẽ. Chữ 人 được vẽ như thể sắp nằm xuống sàn. Chữ 臥, kết hợp thêm chữ 臣, biểu hiện nghĩa nằm xuống sàn để đi ngủ.",,,,,
完,,,"Chữ 完 là chữ có nghĩa là 'hoàn toàn' hay 'hoàn thành công việc'. Chữ 完 là hình ảnh kết hợp giữa chữ 宀 (miên - mái nhà) và chữ 元 (nguyên - đầu tiên). Chữ 元 vẽ đầu người được nhấn mạnh, có nghĩa là 'đứng đầu' hay 'ban đầu'. Chữ 完 ban đầu là chữ được tạo ra để chỉ việc xây nhà xong. Khi xây nhà, phải xây chắc chắn để ở được lâu. Vì vậy, chữ 完 ứng dụng chữ 元 có nghĩa là 'đứng đầu' để tạo ra chữ có nghĩa là 'xây nhà tốt nhất', tức là xây nhà tốt. Xây nhà tốt có nghĩa là công trình đã hoàn thành. Do đó, chữ 完 cũng có nghĩa là 'kết thúc' hay 'hoàn thành công việc'.",,,,,
式,,,"Chữ 式 là chữ có nghĩa là 'luật', 'nghi thức', 'chế độ', 'hình dạng'. Chữ 式 là hình ảnh kết hợp giữa chữ 弋 (ích - cọc) và chữ 工 (công - thợ). Chữ 弋 vẽ cái cọc dùng để bắt động vật, nhưng ở đây chỉ đóng vai trò phát âm 'ích→thức'. Chữ 工 được dùng trong chữ 式 có nghĩa là 'thợ'. Thợ làm đồ vật theo tiêu chuẩn mà họ đã đặt ra. Do đó, chữ 式 có nghĩa là 'pháp thức', 'chế độ', 'nghi thức' từ ý nghĩa quy tắc của người thợ.",,,,,
句,,,"Chữ 句 là chữ có nghĩa là 'câu văn' hay 'cong'. Chữ 句 là hình ảnh kết hợp giữa chữ 勹 (bao - bao bọc) và chữ 口 (khẩu - miệng). Tuy nhiên, nhìn vào chữ 句 trong giáp cốt văn, chữ 口 được vẽ ở giữa chữ 丩 (cù - vướng víu). Điều này biểu hiện cảnh buộc dây vào cọc. Vì vậy, chữ 句 được dùng với nghĩa là 'cong' hay 'uốn cong' vì dây quấn quanh cọc. Tuy nhiên, từ kim văn trở đi, hình dạng dây được biểu thị bằng chữ 勹 và ý nghĩa cũng chuyển sang 'câu văn' hay 'đoạn văn', có nghĩa là nhiều chữ viết lẫn lộn.",,,,,
故,,,"Chữ 故 là chữ có nghĩa là 'ngày xưa' hay 'chuyện cũ'. Chữ 故 là hình ảnh kết hợp giữa chữ 古 (cổ - xưa) và chữ 攵 (phác - đánh). Chữ 古 có nghĩa là 'ngày xưa' từ ý nghĩa kể lại chuyện chiến tranh đã xảy ra rất lâu trước đây. Chữ 故, được thêm chữ 攵, ban đầu là chữ được tạo ra để biểu hiện nghĩa 'nguyên nhân' hay 'lý do' của một việc nào đó. Có nghĩa là, ở đây nó có lẽ là nghĩa 'lý do' chiến tranh xảy ra. Tuy nhiên, hiện nay nghĩa 'ngày xưa' đã được mở rộng, nên chữ 古 và chữ 故 thường được dùng mà không phân biệt nhiều. Tuy nhiên, chữ 古 chủ yếu có nghĩa là 'đã lâu', còn chữ 故 thường có nghĩa là 'ngày xưa' hay 'chuyện cũ'.",,,,,
答,,,"Chữ 答 là chữ có nghĩa là 'trả lời' hay 'hồi đáp'. Chữ 答 là hình ảnh kết hợp giữa chữ 竹 (trúc - tre) và chữ 合 (hợp - hợp lại). Chữ 合 vẽ cái bát có nắp, có nghĩa là 'hợp lại'. Tuy nhiên, nhìn vào chữ 答 trong kim văn, chữ 艸 (thảo - cỏ) được dùng thay cho chữ 竹 (trúc). Điều này có nghĩa là chữ 答 ban đầu là chữ liên quan đến thực vật. Chữ 答 ban đầu là chữ được tạo ra để chỉ 'vỏ đậu'. Chữ 合 ở đây biểu hiện vỏ đậu bao bọc hạt đậu. Tuy nhiên, từ khải thư trở đi, chữ 艸 đổi thành chữ 竹 và được dùng với nghĩa là trao đổi thư từ bằng thẻ tre (죽간). Từ đó, nghĩa 'trả lời' được phái sinh.",,,,,
干,,,"Chữ 干 là chữ có nghĩa là 'lá chắn' hay 'ngăn chặn'. Chữ 干 vẽ cái lá chắn. Tuy nhiên, chữ 干 trong giáp cốt văn không vẽ lá chắn dùng để chống mũi tên hay gươm. Bởi vì chữ 干 vẽ lá chắn dùng để bịt kín lối vào để kẻ địch không dễ dàng vào thành, chứ không phải lá chắn cầm tay. Cái này còn được gọi là 'lộc giác sách (鹿角柵)' vì nó giống sừng hươu. Nghĩa là, chữ 干 vẽ hình ảnh các thanh gỗ dài được đan lại với nhau. Mục đích của lá chắn là phòng ngự sự tiến vào của kẻ địch, nên chữ 干 có nghĩa là 'ngăn chặn' hay 'phòng ngự'. Tuy nhiên, trong Hán tự thông dụng, các chữ dùng chữ 干 làm bộ thủ hầu hết chỉ đóng vai trò hình dạng.",,,,,
成,,,"Chữ 成 là chữ có nghĩa là 'hoàn thành', 'được trang bị', 'hoàn tất'. Chữ 成 là hình ảnh kết hợp giữa chữ 戊 (mậu - mâu) và chữ 丁 (đinh - cái đinh). Chữ 戊 vẽ cây mâu có lưỡi hình bán nguyệt, có nghĩa là 'cây mâu'. Chữ 成, được thêm chữ 丁 vào chữ 戊 vẽ cây mâu như vậy, ban đầu được tạo ra với nghĩa là 'bình định'. Nghĩa 'bình định' ở đây là khuất phục kẻ địch. Chữ 成 sau này được mở rộng ý nghĩa là hoàn thành công việc sau khi khuất phục kẻ địch, nên hiện nay có nghĩa là 'hoàn thành', 'hoàn tất'. Chữ 丁 được dùng trong chữ 成 chưa rõ nguồn gốc, nhưng có thể là vai trò phát âm 'đinh→thành', hoặc có thể là biểu hiện hành động đóng đinh để kết thúc một việc.",,,,,
绩,,,"Chữ 績 là chữ có nghĩa là 'dệt', 'vá', 'se chỉ'. Chữ 績 là hình ảnh kết hợp giữa chữ 糸 (mịch - sợi tơ mảnh) và chữ 責 (trách - mắng). Chữ 責 có nghĩa là 'mắng', nhưng ở đây đóng vai trò phát âm 'trách→tích'. Chữ 績 ban đầu là chữ được tạo ra để biểu hiện nghĩa 'se chỉ'. 'Se chỉ' là việc kéo sợi từ guồng quay. Quá trình luộc kén tằm lấy sợi và sau đó se chỉ bằng guồng quay để tạo thành cuộn chỉ cần rất nhiều thời gian và công sức. Do đó, chữ 績 ban đầu có nghĩa là 'se chỉ', sau này có nghĩa là 'thành quả' hay 'công lao' tương ứng với nỗ lực.",,,,,
娜,,,Được tạo thành từ bộ nữ (女 ☞ phụ nữ) biểu thị ý nghĩa và chữ 那 (na) biểu thị âm đọc (na).,,,,,
念,,心,"Chữ 念 là chữ có nghĩa là 'suy nghĩ' hay 'ghi nhớ'. Chữ 念 là hình ảnh kết hợp giữa chữ 今 (kim - bây giờ) và chữ 心 (tâm - tim). Chữ 今 vẽ hình miệng bị lật ngược. Vì vậy, nghĩa gốc là 'ngậm trong miệng'. Chữ 念, kết hợp chữ 心 vào chữ 今 vẽ miệng bị lật ngược như vậy, được vẽ với hình ảnh lời nói không thoát ra ngoài mà đi vào trái tim. Người xưa tin rằng suy nghĩ là do trái tim thực hiện chứ không phải bộ não. Vì vậy, chữ 念 là chữ biểu hiện cảnh suy nghĩ trong đầu không thoát ra ngoài được.",,,,,
笑,,,"Chữ 笑 là chữ có nghĩa là 'nụ cười', 'cười', 'chế giễu'. Chữ 笑 là hình ảnh kết hợp giữa chữ 竹 (trúc - tre) và chữ 夭 (yểu - non nớt). Chữ 夭 vẽ em bé vẫy tay nghịch ngợm. Chữ 笑, kết hợp chữ 竹 lên đầu em bé đang nghịch ngợm như vậy, chữ 竹 được ứng dụng để biểu hiện dáng vẻ cười mỉm bằng mắt.",,,,,
熟,,,"Chữ 熟 là chữ có nghĩa là 'chín', 'nấu chín', 'chín tới'. Chữ 熟 là hình ảnh kết hợp giữa chữ 孰 (thục - ai) và chữ 火 (hỏa - lửa). Tuy nhiên, nhìn vào chữ 孰 trong giáp cốt văn, cảnh tế lễ trước miếu thờ được vẽ. Vì vậy, trong thời cổ đại, chữ 孰 được dùng với nghĩa là 'chín' từ nghĩa dâng vật tế lễ đã nấu chín. Trong tiểu triện, chữ 羊 (dương - cừu) được thêm vào để truyền đạt rõ ràng hơn ý nghĩa dâng vật tế lễ đã nấu chín. Tuy nhiên, sau khi chữ 孰 được giả tá (mượn nghĩa) cho nghĩa là 'ai', chữ 熟 được thêm chữ 火 vào để thay thế nghĩa 'chín'.",,,,,
糟,,,Được tạo thành từ bộ mễ (米 ☞ gạo) biểu thị ý nghĩa và chữ 曹 (tào) biểu thị âm đọc (jo).,,,,,
糕,,,Được tạo thành từ bộ mễ (米 ☞ gạo) biểu thị ý nghĩa và chữ 羔 (cao) biểu thị âm đọc (go).,,,,,
页,,,"Chữ 頁 là chữ có nghĩa là 'đầu' của người. Chữ 頁 có nghĩa là 'đầu', nhưng thực chất nó là vẽ đầu, mắt và chân của con người cùng nhau. Nhìn vào chữ 頁 trong giáp cốt văn, đầu to và tóc của người được nhấn mạnh. Hình ảnh này dần thay đổi và trở thành chữ 頁 hiện nay. Vì chữ 頁 vẽ đầu người được nhấn mạnh, nên khi kết hợp với các chữ khác, nó chủ yếu truyền đạt ý nghĩa liên quan đến 'đầu' hay 'khuôn mặt'. Nó ít được dùng đứng một mình mà chủ yếu kết hợp với các chữ khác để truyền đạt ý nghĩa liên quan đến 'đầu'.",,颜,,,
豆,,,"Chữ 豆 là chữ có nghĩa là 'đậu' hay 'đồ tế'. Chữ 豆 trong giáp cốt văn vẽ cái bát dùng để tế lễ. Có lẽ vì thường đựng đậu trong bát tế lễ nên chữ 豆 được giả tá (mượn nghĩa) thành nghĩa 'đậu' từ thời nhà Hán. Tuy nhiên, vì chữ 豆 ban đầu vẽ cái bát tế lễ, nên khi kết hợp với các chữ khác, nó vẫn truyền đạt ý nghĩa liên quan đến 'đồ tế' hay 'tế lễ'. Tuy nhiên, trong một số chữ như 鼓 (cổ - trống), nó cũng đóng vai trò hình dạng.",,,,,
卡,,,"<div><p dir=""auto""><strong>卡 (kǎ/qiǎ):</strong> Khạp (phiên âm Hán Việt ít dùng), ca (phiên âm thông dụng hơn), thẻ, kẹt, mắc, chặn. <em>Thẻ: Mảnh giấy, nhựa dùng để ghi thông tin hoặc thanh toán.</em> <em>Kẹt/mắc/chặn: Bị cản trở, không thể di chuyển.</em></p> <ul> <li dir=""auto""><strong>Bộ thủ:</strong> 卜 (bốc - xem bói)</li> <li dir=""auto""><strong>Cấu trúc:</strong> Chữ hội ý (會意字). <ul> <li dir=""auto"">上 (thượng): Trên.</li> <li dir=""auto"">下 (hạ): Dưới.</li> </ul> </li> <li dir=""auto""><strong>Giải thích:</strong> Chữ 卡 gợi hình ảnh một vật bị kẹt giữa hai vật khác (trên 上 và dưới 下), không thể di chuyển.</li> <li dir=""auto""><strong>卡片 (kǎ piàn):</strong> Thẻ, thiệp.</li> <li dir=""auto""><strong>信用卡 (xìn yòng kǎ):</strong> Thẻ tín dụng. <em>Thẻ tín dụng: Thẻ cho phép người dùng mua hàng trả sau.</em></li> <li dir=""auto""><strong>卡车 (kǎ chē):</strong> Xe tải (từ phiên âm ""car"" trong tiếng Anh).</li> <li dir=""auto""><strong>卡住 (qiǎ zhù):</strong> Bị kẹt, bị mắc.</li> </ul></div>",,,,,
晒,,,Được tạo thành từ bộ nhật (日 ☞ mặt trời) biểu thị ý nghĩa và chữ 西 (tây→sái) đồng thời biểu thị âm đọc (seo→swae) và ý nghĩa 'khô'.,,,,,
惯,,,"Chữ 慣 là chữ có nghĩa là 'quen thuộc' hay 'thói quen'. Chữ 慣 là hình ảnh kết hợp giữa chữ 心 (tâm - tim) và chữ 貫 (quán - xuyên qua). Chữ 貫 vẽ cảnh cắm thanh gỗ dài để cố định vật gì đó, có nghĩa là 'xuyên qua'. Thói quen là thứ đã quen thuộc từ lâu nên khó thay đổi. Do đó, chữ 慣, kết hợp chữ 心 vào chữ 貫 vẽ cảnh cố định vật gì đó như vậy, có nghĩa là 'trái tim (心) đã cố định (貫)', tức là 'thói quen' hay 'tập quán' đã quen thuộc. Thực ra, trong tiểu triện, chữ 遦 (quan - đi lại) có chữ 辶 (sước - đi chậm) được dùng với nghĩa 'quen thuộc', nhưng trong khải thư, chữ 慣 đã thay thế nghĩa đó.",,,,,
贯,,,"Chữ 貫 là chữ có nghĩa là 'xuyên qua' hay 'đâm thủng'. Chữ 貫 là hình ảnh kết hợp giữa chữ 毌 (quán - xuyên thủng) và chữ 貝 (bối - vỏ sò). Chữ 毌 vẽ cảnh xuyên thủng thanh gỗ dài để cố định vật gì đó, có nghĩa là 'xuyên thủng'. Do đó, ban đầu chữ 毌 được dùng với nghĩa là 'xuyên qua'. Tuy nhiên, sau đó đồng tiền lá có lỗ xỏ dây (엽전) bắt đầu lưu hành, nên trong tiểu triện, chữ 貫, kết hợp chữ 貝 vào chữ 毌, được dùng với nghĩa là 'xuyên qua'.",,,,,
慢,,,"Chữ 慢 là chữ có nghĩa là 'ngạo mạn' hay 'lười biếng'. Chữ 慢 là hình ảnh kết hợp giữa chữ 心 (tâm - tim) và chữ 曼 (mạn - kéo dài). Chữ 曼 vẽ cảnh dùng tay kéo mí mắt ra. Chữ 慢 ứng dụng chữ 曼 vẽ cảnh trợn mắt như vậy để biểu hiện thái độ ngạo mạn hay kiêu căng. Việc trợn mắt được ví với sự ngạo mạn. Thái độ ngạo mạn gợi liên tưởng đến sự lười biếng. Do đó, chữ 慢 không chỉ có nghĩa là 'ngạo mạn' mà còn phái sinh nghĩa 'lười biếng'.",,,,,
性,,,"Chữ 性 là chữ có nghĩa là 'tính cách' hay 'bản chất'. Chữ 性 là hình ảnh kết hợp giữa chữ 心 (tâm - tim) và chữ 生 (sinh - sinh ra). Chữ 生 vẽ cảnh cây cỏ mọc lên, có nghĩa là 'sinh ra'. Chữ 性, kết hợp chữ 心 với chữ 生 có nghĩa 'sinh ra' như vậy, được tạo ra với nghĩa là 'bản tính (心) trời sinh (生)'. Mỗi người đều có thiên tính trời sinh. Có đứa trẻ ít nói và hiền lành, nhưng có đứa lại không chịu ngồi yên một lúc nào. Không chỉ ví dụ như vậy, chữ 性 chỉ bản tính mà con người có được từ khi sinh ra. Vì nó chỉ những thứ rất nguyên thủy, nên đôi khi nó cũng có nghĩa là quan hệ tình dục giữa hai giới.",,,,,
功,,,"Chữ 功 là chữ có nghĩa là 'công lao', 'thành tích', 'công việc'. Chữ 功 là hình ảnh kết hợp giữa chữ 工 (công - thợ) và chữ 力 (lực - sức mạnh). Chữ 工 vẽ cái đầm đất (달구), dụng cụ dùng để đầm đất. Vì vậy, có thể nói chữ 功 biểu hiện cảnh dùng sức mạnh cầm dụng cụ đầm đất. Đầm đất là dụng cụ dùng để đầm đất cho chắc chắn để xây tường thành hoặc đê điều. Trong thời đại coi trọng chiến tranh và trị thủy, việc xây thành và đê điều đều là công việc liên quan đến quốc gia. Do đó, chữ 功 có nghĩa là 'công lao', 'thành tích', 'công việc' từ ý nghĩa dốc sức vì việc nước.",,,,,
处,,,"Chữ 處 là chữ có nghĩa là 'nơi', 'lúc', 'ở lại'. Chữ 處 là hình ảnh kết hợp giữa chữ 虎 (hổ - cọp) và chữ 処 (xử - nơi). Chữ 處 ban đầu là chữ 処 được dùng trước. Nhìn vào chữ 処 trong giáp cốt văn, chỉ có chữ 止 (chỉ - chân) và chữ 冖 (mịch - che đậy) được vẽ, điều này có nghĩa là chân người đang ở trên bàn. Trong kim văn, chữ 人 (nhân - người) được dùng thay cho chữ 止, biểu hiện người đang dựa vào bàn. Chữ 処 là sự kết hợp của hai hình thức này, có nghĩa là người đang dựa vào bàn và dừng lại một chút. Sau đó, trong tiểu triện, chữ 処 kết hợp với chữ 虎, tạo thành chữ 處 vẽ hình con cọp đang ngồi.",,,,,
净,,,"Chữ hội ý. 冫 giản thể của bộ thủy biểu thị nước đá. Chữ tranh (争 - đấu tranh, tranh giành). Tượng trưng việc dùng nước làm sạch vết bẩn. Nghĩa sạch sẽ, thanh tịnh. 静 (tĩnh - thường mang nghĩa tĩnh lặng) và 净 (tịnh - thường mang nghĩa sạch sẽ) có âm đọc giống nhau (jìng), hình dạng chữ và ý nghĩa lại có những điểm gần gũi, nên trong các sách cổ, người ta thường dùng hai chữ này thay thế lẫn nhau.","【干净】

Sạch sẽ: 干净.",,,,
般,,,舟 (chu) hình ảnh chiếc thuyền; 殳 (thù) hình ảnh tay cầm binh khí dài (làm bằng tre) tượng trưng cho việc tay cầm sào tre.  Biểu thị hành động cầm sào chèo thuyền qua sông. Nghĩa gốc chỉ việc dùng sào tre chống thuyền để đưa người và hàng hóa qua lại giữa hai bờ sông.,"【一般】
Nghĩa gốc chèo thuyền chờ người và hàng hóa qua sông.
* dạng; loại; kiểu: 一般 (một kiểu - thông thường)",,,,
泳,,,"Chữ 泳 là chữ có nghĩa là 'bơi' hay 'lặn'. Chữ 泳 là hình ảnh kết hợp giữa chữ 水 (thủy - nước) và chữ 永 (vĩnh - dài). Chữ 永 vẽ cảnh dòng nước uốn khúc chảy ra nơi khác. Chữ 泳, được thêm chữ 水 vào đó, có nghĩa là bơi lâu trong nước. Chữ 泳 ban đầu là chữ có nghĩa là bơi lặn. Tuy nhiên, theo thời gian, nó có nghĩa là bơi trên mặt nước.",,,,,
油,,,"Chữ 油 là chữ có nghĩa là 'dầu', 'màng dầu', 'bóng loáng'. Chữ 油 là hình ảnh kết hợp giữa chữ 水 (thủy - nước) và chữ 由 (do - do bởi). Chữ 由 vẽ 'đèn dầu' dùng để thắp sáng phòng. Để thắp sáng đèn dầu cần dầu, nên chữ 水 được dùng trong chữ 油 có thể được xem là biểu hiện chất lỏng đó. Ngoài nghĩa đơn thuần là 'dầu', chữ 油 còn phái sinh các nghĩa liên quan đến đặc tính của dầu như 'bóng loáng' hay 'màng dầu'.",,,,,
腻,,,"<div><p dir=""auto"">Chữ 腻 (nị) là chữ mang ý nghĩa 'béo', 'ngấy', 'nhẵn', 'bóng', 'mịn màng', 'chán ngán'.</p> <ul> <li dir=""auto""><strong>腻 (nì):</strong> Nị, béo, ngấy, nhẵn, bóng, mịn màng, chán ngán, chán chường. <ul> <li dir=""auto""><em>Béo/ngấy: Có nhiều dầu mỡ, gây cảm giác ngán khi ăn.</em></li> <li dir=""auto""><em>Nhẵn/bóng/mịn màng: Bề mặt trơn tru, không gồ ghề.</em></li> <li dir=""auto""><em>Chán ngán/chán chường: Cảm giác không còn hứng thú, mệt mỏi.</em></li> </ul> </li> <li dir=""auto""><strong>Đây là dạng giản thể của chữ 膩 (nị).</strong></li> <li dir=""auto""><strong>Cấu trúc chữ:</strong> Chữ hình thanh (形聲字). Chữ 腻 được tạo thành do sự kết hợp của bộ ""nhục nguyệt"" (月) biểu thị ý nghĩa và chữ 貳 (nhị) biểu thị âm đọc. <ul> <li dir=""auto""><strong>月 (nhục nguyệt):</strong> Bộ Nhục Nguyệt (thịt, cơ thể). Thường liên quan đến cơ thể, thịt, mỡ. (Trong tiếng Hàn gọi là 육달월 /yuk-dal-wol/).</li> <li dir=""auto""><strong>貳 (nhị):</strong> Nhị, hai (số đếm); bất trung, phản trắc (trong trường hợp này dùng để biểu âm).</li> </ul> </li> <li dir=""auto""><strong>Giải thích nguồn gốc và ý nghĩa:</strong> <ul> <li dir=""auto"">Chữ 腻 (và dạng nguyên thủy 膩) kết hợp bộ 月 (nhục nguyệt - thịt/mỡ) với thành phần 貳 (biểu âm). Ý nghĩa ""béo"", ""ngấy"" xuất phát trực tiếp từ bộ 月 liên quan đến <strong>thịt và mỡ</strong>.</li> <li dir=""auto"">Ý nghĩa ""nhẵn"", ""bóng"", ""mịn màng"" có thể liên quan đến cảm giác khi sờ vào <strong>thịt</strong> hoặc <strong>mỡ</strong> (có độ trơn, nhẵn).</li> <li dir=""auto"">Ý nghĩa ""chán ngán"", ""chán chường"" là ý nghĩa phái sinh, có thể xuất phát từ cảm giác khi ăn quá nhiều <strong>thịt béo</strong>, gây cảm giác ngán và chán.</li> </ul> </li> <li dir=""auto""><strong>Ứng dụng:</strong> <ul> <li dir=""auto""><strong>油腻 (yóu nì):</strong> Béo ngấy, nhiều dầu mỡ.</li> <li dir=""auto""><strong>细腻 (xì nì):</strong> Tinh tế, tỉ mỉ (thường dùng để miêu tả cảm xúc, chi tiết). <em>Tinh tế/tỉ mỉ: Rất nhỏ, chi tiết và khéo léo.</em></li> <li dir=""auto""><strong>腻烦 (nì fan):</strong> Chán ngán, phiền toái. <em>Phiền toái: Gây khó chịu, rắc rối.</em></li> <li dir=""auto""><strong>不腻 (bù nì):</strong> Không ngán, ăn không chán.</li> </ul> </li> </ul></div>",,,,,
活,,,"Chữ 活 là chữ có nghĩa là 'sống', 'đang sống'. Chữ 活 là hình ảnh kết hợp giữa chữ 水 (thủy - nước) và chữ 舌 (thiệt - lưỡi). Chữ 舌 vẽ hình lưỡi rắn, có nghĩa là 'lưỡi'. Vì vậy, người ta thường giải thích chữ 活 có nghĩa là 'đang sống' với ý nghĩa là lưỡi (舌) có độ ẩm (水). Tuy nhiên, trong tiểu triện, thay vì chữ 舌, người ta dùng chữ ‘氏+口(quạt)’ có nghĩa là 'lưu thông thuận lợi'. Điều này có nghĩa là 'dòng nước chảy thuận lợi'. Dòng nước chảy ở đây có nghĩa là máu trong cơ thể đang lưu thông thuận lợi. Tuy nhiên, trong tiểu triện, khi sự kết hợp các bộ phận của chữ thay đổi, cách giải thích cũng khác đi.",,,,,
奶,,,Được tạo thành từ bộ nữ (女 ☞ phụ nữ) biểu thị ý nghĩa và chữ 乃 (nãi) biểu thị âm đọc (nae).,,,,,
燥,,,"Chữ 燥 là chữ có nghĩa là 'khô', 'buồn bã', 'lo lắng'. Chữ 燥 là hình ảnh kết hợp giữa chữ 火 (hỏa - lửa) và chữ 喿 (táo - kêu). Chữ 喿 vẽ cảnh chim hót líu lo trên cây, có nghĩa là 'kêu' hay 'ồn ào'. Cảnh chim hót líu lo trên cây gợi lên sự gấp gáp hay lo lắng. Vì vậy, chữ 燥 được thêm chữ 火 vào chữ 喿 gợi lên sự lo lắng như vậy, để diễn tả trạng thái lo lắng khi thế giới đang cháy khô vì hạn hán.",,,,,
菜,,,"Chữ 菜 là chữ có nghĩa là 'rau dại' hay 'món ăn kèm'. Chữ 菜 là hình ảnh kết hợp giữa chữ 艹 (thảo - cỏ) và chữ 采 (thái - hái). Chữ 采 vẽ cảnh dùng tay hái quả. Chữ 菜, được thêm chữ 艹 vào chữ 采 vẽ cảnh thu hái quả như vậy, được tạo ra với nghĩa là 'hái rau dại'. Chữ 菜 có nghĩa là 'rau dại', nhưng đôi khi cũng có nghĩa là món ăn kèm làm từ rau dại hoặc món nhắm.",,,,,
散,,,"Chữ 散 là chữ có nghĩa là 'phân tán' hay 'chia ly'. Chữ 散 là hình ảnh kết hợp giữa chữ 㪔 (tán - phân tán) và chữ ⺼ (nhục nguyệt - thịt). Chữ 㪔 vẽ cảnh dùng gậy đập 'ma' (một loại cây) để làm tơi ra, có nghĩa là 'phân tán'. Vì vậy, ban đầu chữ 㪔 được dùng với nghĩa 'phân tán'. Trong tiểu triện, chữ 散 được thêm chữ 肉 vào, được tạo ra với nghĩa là đập thịt cho mềm ra. Khi nghĩ đến món Sanjeok (산적 - thịt xiên nướng) cúng trong các buổi tế lễ, sẽ dễ hiểu. Chữ 散 có nghĩa là 'phân tán' từ hình ảnh đập thịt như vậy, nhưng vì 'phân tán' gợi nhớ đến sự chia ly, nên sau đó nghĩa 'chia ly' cũng được phái sinh.",,,,,
记,,,"Chữ 記 là chữ có nghĩa là 'ghi chép' hay 'ghi nhớ'. Chữ 記 là hình ảnh kết hợp giữa chữ 言 (ngôn - lời nói) và chữ 己 (kỷ - mình). Chữ 己 vẽ hình sợi dây được kéo dài ra, có nghĩa là 'tôi' hay 'bản thân'. Hành động ghi nhớ hoặc ghi nhớ là việc lưu trữ một lời nói hoặc một sự kiện nào đó vào trong đầu mình. Vì vậy, chữ 記 có thể được giải thích là chữ được tạo ra với nghĩa là 'lưu trữ lời nói (言) vào trong đầu của tôi (己)'. Do đó, chữ 記 ban đầu được dùng với nghĩa là ghi nhớ lời nói trong đầu, nhưng sau đó nghĩa được mở rộng và có nghĩa là 'ghi chép', 'viết lại'.",,,,,
